{
  "ref": "container-registries-registre-check",
  "node": "container-registries",
  "lesson": "quest-ce-quun-registre",
  "title": "Qu'est-ce qu'un registre",
  "description": "Registre = entrepôt d'images, Docker Hub par défaut, cycle build/push/pull, public vs privé, norme OCI.",
  "questions": [
    {
      "type": "MCQ",
      "prompt": "À quoi sert un registre de conteneurs ?",
      "justification": "Un registre est un entrepôt en ligne qui stocke et distribue les images entre les machines, comme un dépôt Git le fait pour le code (le « GitHub des images »).",
      "position": 0,
      "options": [
        { "label": "Stocker et distribuer les images de conteneurs entre les machines", "correct": true, "position": 0 },
        { "label": "Compiler le code source de l'application", "correct": false, "position": 1 },
        { "label": "Surveiller la mémoire d'un conteneur en cours d'exécution", "correct": false, "position": 2 }
      ]
    },
    {
      "type": "MCQ",
      "prompt": "Quand tu tapes `docker pull nginx` sans préciser d'adresse, d'où vient l'image ?",
      "justification": "Docker Hub est le registre public par défaut : sans adresse explicite, Docker y va chercher l'image.",
      "position": 1,
      "options": [
        { "label": "De Docker Hub, le registre public par défaut", "correct": true, "position": 0 },
        { "label": "D'un dossier caché sur ta machine", "correct": false, "position": 1 },
        { "label": "Du dépôt Git du projet", "correct": false, "position": 2 }
      ]
    },
    {
      "type": "MCQ",
      "prompt": "Pourquoi les commandes `docker push` et `docker pull` sont-elles identiques que l'on utilise Docker Hub, GHCR ou ECR ?",
      "justification": "Tous ces registres respectent la même norme, la distribution-spec OCI ; seuls l'adresse (URL) et l'authentification changent.",
      "position": 2,
      "options": [
        { "label": "Parce qu'ils suivent tous la même norme, la distribution-spec OCI", "correct": true, "position": 0 },
        { "label": "Parce qu'ils appartiennent tous à la même entreprise", "correct": false, "position": 1 },
        { "label": "Parce que Docker recopie les images entre eux automatiquement", "correct": false, "position": 2 }
      ]
    },
    {
      "type": "TRUE_FALSE",
      "prompt": "Un dépôt d'image privé est accessible librement, sans avoir à s'authentifier.",
      "justification": "Faux : un dépôt privé exige une authentification (prouver son identité). Seul un dépôt public est accessible à tous sans identifiant.",
      "position": 3,
      "options": [
        { "label": "Vrai", "correct": false, "position": 0 },
        { "label": "Faux", "correct": true, "position": 1 }
      ]
    }
  ]
}
