{
  "ref": "testing-pyramide-check",
  "node": "testing",
  "lesson": "la-pyramide-des-tests",
  "title": "Quiz : La pyramide des tests",
  "description": "Les trois niveaux, le dosage de la pyramide, l'anti-pattern cornet de glace, pourquoi tester.",
  "questions": [
    {
      "type": "MCQ",
      "prompt": "Que recommande la pyramide des tests ?",
      "justification": "Beaucoup d'unitaires rapides à la base, quelques tests d'intégration, très peu d'end-to-end au sommet.",
      "position": 0,
      "options": [
        { "label": "Beaucoup d'unitaires, quelques intégrations, très peu d'e2e", "correct": true, "position": 0 },
        { "label": "Surtout des tests end-to-end, presque pas d'unitaires", "correct": false, "position": 1 },
        { "label": "Autant de tests à chaque niveau", "correct": false, "position": 2 }
      ]
    },
    {
      "type": "MCQ",
      "prompt": "Qu'est-ce qui distingue un test unitaire d'un test end-to-end ?",
      "justification": "L'unitaire vérifie une brique isolée sans base ni réseau (rapide) ; l'e2e vérifie le système complet comme un vrai utilisateur (lent, coûteux).",
      "position": 1,
      "options": [
        { "label": "L'unitaire teste une brique isolée et rapide ; l'e2e teste le système complet, lent et coûteux", "correct": true, "position": 0 },
        { "label": "L'unitaire est toujours plus lent que l'e2e", "correct": false, "position": 1 },
        { "label": "Il n'y a aucune différence, seuls les noms changent", "correct": false, "position": 2 }
      ]
    },
    {
      "type": "TRUE_FALSE",
      "prompt": "L'anti-pattern du « cornet de glace » (beaucoup d'e2e, peu d'unitaires) donne une suite de tests lente et fragile.",
      "justification": "Vrai : en inversant la pyramide, chaque test prend des secondes et le moindre détail casse tout. On rééquilibre vers plus d'unitaires.",
      "position": 2,
      "options": [
        { "label": "Vrai", "correct": true, "position": 0 },
        { "label": "Faux", "correct": false, "position": 1 }
      ]
    },
    {
      "type": "MCQ",
      "prompt": "Quel est le vrai rôle des tests ?",
      "justification": "Ils verrouillent le comportement : un test qui passe échouera si un changement casse ce comportement, attrapant les régressions avant les utilisateurs.",
      "position": 3,
      "options": [
        { "label": "Verrouiller le comportement et attraper les régressions avant les utilisateurs", "correct": true, "position": 0 },
        { "label": "Prouver mathématiquement qu'il n'y a aucun bug", "correct": false, "position": 1 },
        { "label": "Remplacer complètement la relecture de code", "correct": false, "position": 2 }
      ]
    }
  ]
}
