{
  "ref": "streams-modernes-rappel-des-streams",
  "node": "streams-modernes",
  "lesson": "rappel-des-streams",
  "title": "Quiz : rappel des streams",
  "description": "Source, opérations intermédiaires, opération terminale et paresse.",
  "questions": [
    {
      "type": "MCQ",
      "prompt": "Dans mots.stream().filter(...).map(...).toList(), laquelle est l'opération terminale ?",
      "justification": "filter et map sont des opérations intermédiaires paresseuses qui renvoient un stream. toList est l'opération terminale : elle déclenche le traitement et produit un résultat concret.",
      "position": 0,
      "options": [
        { "label": "toList()", "correct": true, "position": 0 },
        { "label": "filter(...)", "correct": false, "position": 1 },
        { "label": "map(...)", "correct": false, "position": 2 }
      ]
    },
    {
      "type": "TRUE_FALSE",
      "prompt": "Les opérations intermédiaires comme map et filter s'exécutent tout de suite, même sans opération terminale.",
      "justification": "Faux : les opérations intermédiaires sont paresseuses (lazy). Tant qu'aucune opération terminale n'est appelée, aucun élément ne traverse le pipeline.",
      "position": 1,
      "options": [
        { "label": "Vrai", "correct": false, "position": 0 },
        { "label": "Faux", "correct": true, "position": 1 }
      ]
    },
    {
      "type": "MCQ",
      "prompt": "Quelle opération transforme chaque élément en exactement un autre élément ?",
      "justification": "map transforme chaque élément en un autre (un pour un). filter se contente de garder ou d'écarter sans transformer, et count compte les éléments.",
      "position": 2,
      "options": [
        { "label": "map", "correct": true, "position": 0 },
        { "label": "filter", "correct": false, "position": 1 },
        { "label": "count", "correct": false, "position": 2 }
      ]
    }
  ]
}
