{
  "ref": "what-is-architecture-check",
  "node": "what-is-architecture",
  "lesson": "les-decisions-qui-comptent",
  "title": "Quiz, Qu'est-ce que l'architecture logicielle",
  "description": "Définition, architecture vs design, compromis.",
  "questions": [
    {
      "type": "MCQ",
      "prompt": "Quelle est la définition la plus opérationnelle de l'architecture logicielle ?",
      "justification": "L'ensemble des décisions importantes, celles qui sont coûteuses à changer plus tard (Fowler/Johnson).",
      "position": 0,
      "options": [
        {
          "label": "Les décisions structurantes coûteuses à changer plus tard",
          "correct": true,
          "position": 0
        },
        {
          "label": "Les diagrammes UML tracés au début du projet",
          "correct": false,
          "position": 1
        },
        {
          "label": "Le choix du langage de programmation",
          "correct": false,
          "position": 2
        }
      ]
    },
    {
      "type": "MCQ",
      "prompt": "Qu'est-ce qui distingue l'architecture de la conception détaillée ?",
      "justification": "L'architecture opère à l'échelle du système (frontières, choix transverses, attributs de qualité), le design au niveau du code.",
      "position": 1,
      "options": [
        {
          "label": "L'échelle : système/transverse vs code local",
          "correct": true,
          "position": 0
        },
        {
          "label": "Rien, ce sont des synonymes",
          "correct": false,
          "position": 1
        },
        {
          "label": "L'architecture concerne uniquement la base de données",
          "correct": false,
          "position": 2
        }
      ]
    },
    {
      "type": "TRUE_FALSE",
      "prompt": "En architecture, il existe une meilleure solution universelle qu'il suffit d'appliquer partout.",
      "justification": "Faux : « il n'y a pas de bonnes réponses, seulement des compromis », on choisit le compromis adapté au contexte.",
      "position": 2,
      "options": [
        {
          "label": "Faux",
          "correct": true,
          "position": 0
        },
        {
          "label": "Vrai",
          "correct": false,
          "position": 1
        }
      ]
    }
  ]
}
