{
  "ref": "donner-un-role-check",
  "node": "role-persona",
  "lesson": "donner-un-role",
  "title": "Quiz : Donner un rôle au modèle",
  "description": "Vérifie que tu as compris à quoi sert d'assigner une persona.",
  "questions": [
    {
      "type": "MCQ",
      "prompt": "À quoi sert surtout d'assigner un rôle comme « Tu es un professeur patient » au modèle ?",
      "justification": "Le rôle cadre le ton, le niveau de langue et l'expertise supposée, ce qui permet d'adapter la réponse au public visé. Il ne donne pas au modèle un accès à Internet ni de nouvelles connaissances.",
      "position": 0,
      "options": [
        { "label": "Cadrer le ton, le niveau de langue et l'expertise supposée pour adapter la réponse au public", "correct": true, "position": 0 },
        { "label": "Donner au modèle l'accès à Internet", "correct": false, "position": 1 },
        { "label": "Ajouter de nouvelles connaissances dans le modèle", "correct": false, "position": 2 },
        { "label": "Accélérer le temps de réponse du modèle", "correct": false, "position": 3 }
      ]
    },
    {
      "type": "TRUE_FALSE",
      "prompt": "On place souvent le rôle dans le message système pour qu'il s'applique à toute la conversation.",
      "justification": "Vrai : le message système contient les instructions de départ qui valent pour tous les échanges suivants, c'est donc l'endroit naturel pour poser une persona durable.",
      "position": 1,
      "options": [
        { "label": "Vrai", "correct": true, "position": 0 },
        { "label": "Faux", "correct": false, "position": 1 }
      ]
    }
  ]
}
