{
  "ref": "nouvelles-api-18-21-utf-8-par-defaut",
  "node": "nouvelles-api-18-21",
  "lesson": "utf-8-par-defaut",
  "title": "Quiz : UTF-8 par défaut",
  "description": "Charset, encodage et le changement apporté par la JEP 400.",
  "questions": [
    {
      "type": "MCQ",
      "prompt": "Depuis quelle version de Java le charset par défaut est il UTF-8 sur toutes les machines ?",
      "justification": "La JEP 400, livrée avec Java 18, impose UTF-8 comme charset par défaut partout.",
      "position": 0,
      "options": [
        { "label": "Java 18", "correct": true, "position": 0 },
        { "label": "Java 17", "correct": false, "position": 1 },
        { "label": "Java 21", "correct": false, "position": 2 }
      ]
    },
    {
      "type": "MCQ",
      "prompt": "Que représente un encodage comme UTF-8 ?",
      "justification": "Un encodage est la règle qui transforme des lettres en octets et inversement, de façon que le texte soit stocké et relu correctement.",
      "position": 1,
      "options": [
        { "label": "La règle qui transforme des caractères en octets et inversement", "correct": true, "position": 0 },
        { "label": "La vitesse de lecture d'un fichier sur le disque", "correct": false, "position": 1 },
        { "label": "Le langage de programmation utilisé pour écrire le fichier", "correct": false, "position": 2 }
      ]
    },
    {
      "type": "TRUE_FALSE",
      "prompt": "Même depuis Java 18, préciser explicitement StandardCharsets.UTF_8 reste une bonne habitude.",
      "justification": "C'est vrai : être explicite rend le code clair et garde un comportement correct même sur une version plus ancienne de Java.",
      "position": 2,
      "options": [
        { "label": "Vrai", "correct": true, "position": 0 },
        { "label": "Faux", "correct": false, "position": 1 }
      ]
    }
  ]
}
