{
  "ref": "git-prep-check",
  "node": "git",
  "lesson": "preparer-sa-machine",
  "title": "Quiz, Préparer sa machine",
  "description": "Terminal, installation de Git, configuration initiale.",
  "questions": [
    {
      "type": "MCQ",
      "prompt": "Qu'est-ce que le « terminal » (ligne de commande) ?",
      "justification": "Le terminal est une fenêtre où l'on donne des ordres à l'ordinateur en tapant des commandes texte, au lieu de cliquer. Git s'utilise principalement là.",
      "position": 0,
      "options": [
        {
          "label": "Une fenêtre où l'on tape des commandes texte pour piloter l'ordinateur",
          "correct": true,
          "position": 0
        },
        {
          "label": "Un logiciel de traitement de texte",
          "correct": false,
          "position": 1
        },
        {
          "label": "Un site web pour héberger du code",
          "correct": false,
          "position": 2
        }
      ]
    },
    {
      "type": "MCQ",
      "prompt": "Quelle commande vérifie que Git est bien installé ?",
      "justification": "git --version affiche la version installée ; si elle répond, Git est disponible dans le terminal.",
      "position": 1,
      "options": [
        {
          "label": "git --version",
          "correct": true,
          "position": 0
        },
        {
          "label": "git install",
          "correct": false,
          "position": 1
        },
        {
          "label": "git start",
          "correct": false,
          "position": 2
        }
      ]
    },
    {
      "type": "MCQ",
      "prompt": "À quoi sert la commande `cd` dans le terminal ?",
      "justification": "cd (change directory) déplace le terminal dans un autre dossier, c'est ainsi qu'on va dans le dossier de son projet avant de lancer Git.",
      "position": 2,
      "options": [
        {
          "label": "Changer de dossier (se déplacer dans l'arborescence)",
          "correct": true,
          "position": 0
        },
        {
          "label": "Copier un dossier",
          "correct": false,
          "position": 1
        },
        {
          "label": "Supprimer un dossier",
          "correct": false,
          "position": 2
        }
      ]
    },
    {
      "type": "TRUE_FALSE",
      "prompt": "Configurer son nom et son e-mail (git config user.name / user.email) doit se faire à chaque commit.",
      "justification": "Faux : c'est une configuration qu'on fait une seule fois sur sa machine ; Git l'attache ensuite automatiquement à chacun de tes commits.",
      "position": 3,
      "options": [
        {
          "label": "Vrai",
          "correct": false,
          "position": 0
        },
        {
          "label": "Faux",
          "correct": true,
          "position": 1
        }
      ]
    }
  ]
}
