{
  "ref": "tech-decisions-check",
  "node": "tech-decisions",
  "lesson": "decider-et-tracer",
  "title": "Quiz, Décisions techniques & d'architecture",
  "description": "Compromis, réversibilité, dernier moment responsable, ADR.",
  "questions": [
    {
      "type": "MCQ",
      "prompt": "Comment traiter une décision réversible (« porte à double sens ») à faible impact ?",
      "justification": "On décide vite et on délègue : réanalyser à l'excès une décision facile à défaire est un gaspillage. On investit le soin sur les décisions irréversibles.",
      "position": 0,
      "options": [
        {
          "label": "Décider vite et déléguer, quitte à changer plus tard",
          "correct": true,
          "position": 0
        },
        {
          "label": "Convoquer un comité pendant des semaines",
          "correct": false,
          "position": 1
        },
        {
          "label": "Ne jamais la prendre",
          "correct": false,
          "position": 2
        }
      ]
    },
    {
      "type": "MCQ",
      "prompt": "Que signifie décider au « dernier moment responsable » ?",
      "justification": "Trancher au dernier instant où l'on a encore le choix, avec le maximum d'information, ni trop tôt (on devine), ni trop tard (on subit).",
      "position": 1,
      "options": [
        {
          "label": "Au dernier moment où l'on a encore le choix, avec le max d'info",
          "correct": true,
          "position": 0
        },
        {
          "label": "Le plus tôt possible, avant tout le reste",
          "correct": false,
          "position": 1
        },
        {
          "label": "Après la mise en production",
          "correct": false,
          "position": 2
        }
      ]
    },
    {
      "type": "MCQ",
      "prompt": "Que capture principalement un ADR ?",
      "justification": "Le pourquoi d'une décision : contexte, choix et surtout conséquences, le raisonnement, versionné avec le code.",
      "position": 2,
      "options": [
        {
          "label": "Le contexte, la décision et ses conséquences (le pourquoi)",
          "correct": true,
          "position": 0
        },
        {
          "label": "La liste des tickets ouverts",
          "correct": false,
          "position": 1
        },
        {
          "label": "Le planning de l'équipe",
          "correct": false,
          "position": 2
        }
      ]
    },
    {
      "type": "TRUE_FALSE",
      "prompt": "Vitesse et soin doivent s'appliquer uniformément à toutes les décisions.",
      "justification": "Faux : on investit temps et soin sur les décisions irréversibles/structurantes, on expédie et délègue les décisions réversibles à faible impact.",
      "position": 3,
      "options": [
        {
          "label": "Faux",
          "correct": true,
          "position": 0
        },
        {
          "label": "Vrai",
          "correct": false,
          "position": 1
        }
      ]
    }
  ]
}
