{
  "ref": "design-principles-patterns-check",
  "node": "design-principles",
  "lesson": "design-patterns-gof",
  "title": "Quiz : Design patterns (GOF)",
  "description": "Ce qu'est un pattern, Strategy, Adapter, et le piège du sur-usage.",
  "questions": [
    {
      "type": "MCQ",
      "prompt": "Qu'est-ce qu'un design pattern ?",
      "justification": "C'est une solution type, réutilisable et éprouvée, à un problème de conception récurrent : une recette à adapter, pas du code à copier ni une librairie à installer.",
      "position": 0,
      "options": [
        { "label": "Une solution type réutilisable à un problème de conception récurrent", "correct": true, "position": 0 },
        { "label": "Une librairie qu'on installe avec Maven", "correct": false, "position": 1 },
        { "label": "Un langage de programmation orienté objet", "correct": false, "position": 2 }
      ]
    },
    {
      "type": "MCQ",
      "prompt": "À quoi sert le pattern Strategy ?",
      "justification": "Strategy place un comportement variable derrière une interface injectée, ce qui permet de le changer à l'exécution sans modifier le code client.",
      "position": 1,
      "options": [
        { "label": "Rendre un comportement interchangeable en l'injectant derrière une interface", "correct": true, "position": 0 },
        { "label": "Garantir qu'il n'existe qu'une seule instance d'une classe", "correct": false, "position": 1 },
        { "label": "Créer des objets complexes étape par étape", "correct": false, "position": 2 }
      ]
    },
    {
      "type": "MCQ",
      "prompt": "Dans l'architecture hexagonale, à quel pattern correspond un adaptateur qui implémente un port du domaine ?",
      "justification": "L'Adapter convertit une interface (le port défini par le domaine) en une implémentation concrète (base, web) : c'est exactement le rôle des adaptateurs hexagonaux.",
      "position": 2,
      "options": [
        { "label": "L'Adapter", "correct": true, "position": 0 },
        { "label": "Le Singleton", "correct": false, "position": 1 },
        { "label": "L'Observer", "correct": false, "position": 2 }
      ]
    },
    {
      "type": "TRUE_FALSE",
      "prompt": "Pour un code propre, il faut appliquer le plus de patterns possible.",
      "justification": "Faux : un pattern introduit « parce que c'est propre » ajoute de la complexité sans bénéfice. On reconnaît le problème d'abord, on applique le pattern ensuite ; le design le plus simple qui marche gagne.",
      "position": 3,
      "options": [
        { "label": "Vrai", "correct": false, "position": 0 },
        { "label": "Faux", "correct": true, "position": 1 }
      ]
    }
  ]
}
